{
  "jobId": "00000009-0000-4000-8000-000000000099",
  "correlationId": "00000009-0000-4000-8000-000000000099",
  "documentId": "00000009-0000-4000-8000-000000000000",
  "revision": 1,
  "status": "completed",
  "error": null,
  "proposalGraph": {
    "tenantId": "poc",
    "projectId": "word-authoring",
    "graphIri": "https://example.org/lattice/authoring/doc/00000009-0000-4000-8000-000000000000/rev/1/proposal-graph",
    "revisionHash": "sha256:abababababababababababababababababababababababababababababababab"
  },
  "analysis": {
    "formsProfile": {"profileId": "wap-le-forms", "version": "0.1.0"},
    "elements": [],
    "leProgram": "% empty\n",
    "graphView": {"nodes": [], "edges": []}
  },
  "completedAt": "2026-10-01T00:00:01Z"
}
